review,answer
"¡Excelente relación calidad-precio! Los platos son abundantes y deliciosos, y los precios son muy razonables.","¡Gracias por tus amables palabras! Nos esforzamos por ofrecer calidad a precios accesibles."
"Me sorprendió gratamente lo asequibles que eran los precios, especialmente considerando la alta calidad de la comida que recibimos.","Nos alegra que hayas disfrutado de nuestra oferta. ¡Esperamos verte pronto de nuevo!"
"¡Increíble! La comida es deliciosa y los precios son bastante justos para la calidad que ofrecen.","Nos encanta escuchar eso. ¡Gracias por elegirnos y por tu apreciación!"
"El servicio fue excepcional. El personal fue amable, atento y siempre dispuesto a satisfacer nuestras necesidades.","Agradecemos tus amables palabras. Nuestro equipo se esfuerza por brindar una experiencia excepcional a cada cliente."
"Nos sentimos como en casa gracias al personal atento y amable. Hicieron que nuestra experiencia fuera memorable.","Nos emociona saber que te sentiste así. ¡Esperamos verte de nuevo pronto para otra experiencia inolvidable!"
"El servicio fue impecable. El personal estaba bien informado sobre el menú y nos brindó recomendaciones útiles.","Nos enorgullece recibir tu elogio. ¡Gracias por valorar nuestro servicio!"
"La comida fue una explosión de sabores. Cada plato estaba perfectamente preparado y presentado con esmero.","Estamos encantados de haber podido satisfacer tu paladar. ¡Esperamos que vuelvas pronto por más!"
"Me encantó cada bocado. La comida era fresca, sabrosa y tenía una presentación impecable.","Gracias por tu comentario. Nos alegra saber que disfrutaste de nuestra comida y presentación."
"La comida era exquisita. Cada plato superó mis expectativas y dejó un sabor memorable.","Nos emociona leer tus palabras. ¡Gracias por elegirnos y por tu apoyo!"
"Los precios eran exorbitantes para la calidad de la comida que recibimos. Nos sentimos decepcionados y no creemos que volveremos.","Lamentamos escuchar tu experiencia. Valoramos tus comentarios y los tendremos en cuenta para mejorar."
"Me sentí estafado por los precios. Pagamos mucho más de lo que la comida valía realmente.","Lamentamos que te hayas sentido así. Apreciamos tus comentarios y los tomaremos en cuenta para mejorar nuestra propuesta de valor."
"El servicio dejó mucho que desear. El personal era descortés y parecía estar más interesado en hablar entre ellos que en atender a los clientes.","Lamentamos escuchar sobre tu experiencia. Nos esforzamos por brindar un servicio de calidad y tomaremos medidas para abordar este problema."
"La atención al cliente fue deficiente. Tuvimos que esperar mucho tiempo para ser atendidos, y el personal no parecía preocuparse por nuestra experiencia.","Lamentamos mucho lo ocurrido. Tus comentarios son importantes para nosotros y trabajaremos para mejorar nuestro servicio al cliente."
"La comida era mediocre en el mejor de los casos. Nada destacaba y algunos platos eran incluso insípidos.","Lamentamos no haber cumplido con tus expectativas. Tus comentarios nos ayudan a mejorar y los tomaremos en cuenta para ofrecer una experiencia culinaria más satisfactoria."
"Nos decepcionó la calidad de la comida. Algunos platos estaban demasiado salados, otros demasiado secos. No valió la pena el precio que pagamos.","Lamentamos mucho tu decepción. Tus comentarios son valiosos para nosotros y trabajaremos para mejorar la calidad de nuestros platos y su presentación."